{
  "v": "ACDC10JSON000178_",
  "d": "EOIYbX6Y778lr4M6atdSjAAQIjNzuuaUr6-RP5aGTPsn",
  "i": "EIw_fe9e7TTGUL5nrXfjuzqzGWq7iHc4mzmGiqb_CCGK",
  "ri": "EAEBPOD8GzIYVKlElExZroScFvGbiKdLjbcJ4XuYeOQv",
  "s": "EB4AsU1rKGOAf7m4MS324XhanXq8G01sR_bUdUV2TULm",
  "a": {
    "d": "EI9zQIsQ17lGimLAMHT1D97VkNXsM2bvj5EIBmx8ySPP",
    "dt": "2024-11-01T14:23:16+00:00",
    "digest": "EGvjHeAo7ZRQYUCb3Xh9TBdLhoMuW4lBSmOeR6gkMhMg"
  }
}